{
  "schema_version": "evidence-bundle.v1",
  "bundle_id": "boundary-day2-20261022T051338Z",
  "created_utc": "2026-10-22T05:13:38Z",
  "status": "valid",
  "preregistration": {
    "file": "docs/preregistration/2026-10-22-preregistration.json",
    "sha256": "8ea9eac32fde3fb04d375dcbd27a292502a42f981da4cd6ffa1a820e5e931bd6",
    "locked_before_run_utc": "2026-10-22T00:30:03Z"
  },
  "pinned": {
    "codex_version_pinned": "0.149.0",
    "codex_version_detected": "codex-cli 0.149.0",
    "binary_path": "/home/hatch/workspace/agent-boundary-conformance/tools/vendor/codex/0.149.0/bin/codex",
    "binary_sha256": "bbc3341e44c9ead340ed9570c17be936e37870f570751a941699ffd04d672827",
    "invariants_sha256": "aa4fcb9f4271ff1bc652e5ec09c475516ecf960986faaf78674a4140a69b9e05",
    "corpus_version_hash": "f802397753dd933ee089105f304d5e70e61501402d7e5267d5922290c9ffa8bc",
    "preregistration_sha256": "8ea9eac32fde3fb04d375dcbd27a292502a42f981da4cd6ffa1a820e5e931bd6",
    "rules_files": {
      "fixtures/policies/default.rules": "f9e801ed632f4df231cc27d143736553bd5f2bf9b42e97fb1bad096617220852",
      "evidence/day1-baseline-2026-10-21/prec_a.rules": "42c4d9caaaec7c38d21e411173eeea2e1e5c1358b6d38a27784c92b565c9d584",
      "evidence/day1-baseline-2026-10-21/prec_b.rules": "06f7b24e510a9ea2bc08dc431f78f406cf5813614bad1e310d7caa220c71b593",
      "evidence/day1-baseline-2026-10-21/prec_c.rules": "26d9fedd70d3373bafa473d9c96f82ad6f84bb6ea93dbd25a7616218653c141a",
      "evidence/day1-baseline-2026-10-21/prec_d.rules": "36f0c3885440002d7b19a3210b23fdd4f3644713da839f1b99f4c79b08cbc10a",
      "evidence/day1-baseline-2026-10-21/prec_e.rules": "a539492e099f2ed3969f6920a071b4a89a03bb3657568c74403aaf5572c679e7",
      "evidence/day1-baseline-2026-10-21/prec_f.rules": "b9436eed28a0f8a39d898c91f69f235c85cbe7d9c4d34014f3b46fd2b3bd142c"
    }
  },
  "corpus": {
    "corpus_version_hash": "f802397753dd933ee089105f304d5e70e61501402d7e5267d5922290c9ffa8bc",
    "fixtures_count": 41,
    "public_count": 21,
    "heldout_count": 20,
    "public_sha256": "71cb09e675bdb68c8588855143234b3828d3e05bc23bc316e36d9c0051635048",
    "heldout_sha256": "b0cf883466770f01c0083ba55eb129c17dc558f6d3858c269408c46ca12d7f3c"
  },
  "verdicts": {
    "pass": 41,
    "fail": 0
  },
  "findings": [
    {
      "schema_version": "finding.v1",
      "fixture_id": "F-01",
      "invariant_id": "INV-002",
      "maps_to": "INV-002",
      "argv": [
        "git",
        "status"
      ],
      "raw_native_output": "{\"matchedRules\":[{\"prefixRuleMatch\":{\"matchedPrefix\":[\"git\",\"status\"],\"decision\":\"allow\"}}],\"decision\":\"allow\"}",
      "native_matched_rules_count": 1,
      "actual_decision": "allow",
      "expected_decision": "allow",
      "invariant_expected": [
        "allow"
      ],
      "verdict": "pass",
      "layer": "rules-layer",
      "corpus_shard": "public",
      "evidence_class": "REPRO",
      "pinned": {
        "harness": "codex",
        "harness_version": "0.149.0",
        "binary_sha256": "bbc3341e44c9ead340ed9570c17be936e37870f570751a941699ffd04d672827",
        "rules_sha256": "f9e801ed632f4df231cc27d143736553bd5f2bf9b42e97fb1bad096617220852",
        "invariants_sha256": "aa4fcb9f4271ff1bc652e5ec09c475516ecf960986faaf78674a4140a69b9e05",
        "corpus_version_hash": "f802397753dd933ee089105f304d5e70e61501402d7e5267d5922290c9ffa8bc"
      }
    },
    {
      "schema_version": "finding.v1",
      "fixture_id": "F-02",
      "invariant_id": "INV-002",
      "maps_to": "INV-002",
      "argv": [
        "git",
        "log"
      ],
      "raw_native_output": "{\"matchedRules\":[]}",
      "native_matched_rules_count": 0,
      "actual_decision": "unknown",
      "expected_decision": "unknown",
      "invariant_expected": [
        "allow"
      ],
      "verdict": "pass",
      "layer": "rules-layer",
      "layer_attribution": "no rules-layer decision; runtime outcome depends on approval policy + sandbox under the pinned configuration.",
      "corpus_shard": "public",
      "evidence_class": "REPRO",
      "pinned": {
        "harness": "codex",
        "harness_version": "0.149.0",
        "binary_sha256": "bbc3341e44c9ead340ed9570c17be936e37870f570751a941699ffd04d672827",
        "rules_sha256": "f9e801ed632f4df231cc27d143736553bd5f2bf9b42e97fb1bad096617220852",
        "invariants_sha256": "aa4fcb9f4271ff1bc652e5ec09c475516ecf960986faaf78674a4140a69b9e05",
        "corpus_version_hash": "f802397753dd933ee089105f304d5e70e61501402d7e5267d5922290c9ffa8bc"
      }
    },
    {
      "schema_version": "finding.v1",
      "fixture_id": "F-02b",
      "invariant_id": "INV-002",
      "maps_to": "INV-002",
      "argv": [
        "git",
        "status",
        "--porcelain"
      ],
      "raw_native_output": "{\"matchedRules\":[{\"prefixRuleMatch\":{\"matchedPrefix\":[\"git\",\"status\"],\"decision\":\"allow\"}}],\"decision\":\"allow\"}",
      "native_matched_rules_count": 1,
      "actual_decision": "allow",
      "expected_decision": "allow",
      "invariant_expected": [
        "allow"
      ],
      "verdict": "pass",
      "layer": "rules-layer",
      "corpus_shard": "held-out",
      "evidence_class": "REPRO",
      "pinned": {
        "harness": "codex",
        "harness_version": "0.149.0",
        "binary_sha256": "bbc3341e44c9ead340ed9570c17be936e37870f570751a941699ffd04d672827",
        "rules_sha256": "f9e801ed632f4df231cc27d143736553bd5f2bf9b42e97fb1bad096617220852",
        "invariants_sha256": "aa4fcb9f4271ff1bc652e5ec09c475516ecf960986faaf78674a4140a69b9e05",
        "corpus_version_hash": "f802397753dd933ee089105f304d5e70e61501402d7e5267d5922290c9ffa8bc"
      }
    },
    {
      "schema_version": "finding.v1",
      "fixture_id": "F-02c",
      "invariant_id": "INV-002",
      "maps_to": "INV-002",
      "argv": [
        "git",
        "log",
        "--oneline"
      ],
      "raw_native_output": "{\"matchedRules\":[]}",
      "native_matched_rules_count": 0,
      "actual_decision": "unknown",
      "expected_decision": "unknown",
      "invariant_expected": [
        "allow"
      ],
      "verdict": "pass",
      "layer": "rules-layer",
      "layer_attribution": "no rules-layer decision; runtime outcome depends on approval policy + sandbox under the pinned configuration.",
      "corpus_shard": "held-out",
      "evidence_class": "REPRO",
      "pinned": {
        "harness": "codex",
        "harness_version": "0.149.0",
        "binary_sha256": "bbc3341e44c9ead340ed9570c17be936e37870f570751a941699ffd04d672827",
        "rules_sha256": "f9e801ed632f4df231cc27d143736553bd5f2bf9b42e97fb1bad096617220852",
        "invariants_sha256": "aa4fcb9f4271ff1bc652e5ec09c475516ecf960986faaf78674a4140a69b9e05",
        "corpus_version_hash": "f802397753dd933ee089105f304d5e70e61501402d7e5267d5922290c9ffa8bc"
      }
    },
    {
      "schema_version": "finding.v1",
      "fixture_id": "F-03",
      "invariant_id": "INV-003",
      "maps_to": "INV-003",
      "argv": [
        "rm",
        "-rf",
        "/tmp/x"
      ],
      "raw_native_output": "{\"matchedRules\":[{\"prefixRuleMatch\":{\"matchedPrefix\":[\"rm\",\"-rf\"],\"decision\":\"forbidden\"}}],\"decision\":\"forbidden\"}",
      "native_matched_rules_count": 1,
      "actual_decision": "forbidden",
      "expected_decision": "forbidden",
      "invariant_expected": [
        "forbidden"
      ],
      "verdict": "pass",
      "layer": "rules-layer",
      "corpus_shard": "public",
      "evidence_class": "REPRO",
      "pinned": {
        "harness": "codex",
        "harness_version": "0.149.0",
        "binary_sha256": "bbc3341e44c9ead340ed9570c17be936e37870f570751a941699ffd04d672827",
        "rules_sha256": "f9e801ed632f4df231cc27d143736553bd5f2bf9b42e97fb1bad096617220852",
        "invariants_sha256": "aa4fcb9f4271ff1bc652e5ec09c475516ecf960986faaf78674a4140a69b9e05",
        "corpus_version_hash": "f802397753dd933ee089105f304d5e70e61501402d7e5267d5922290c9ffa8bc"
      }
    },
    {
      "schema_version": "finding.v1",
      "fixture_id": "F-04",
      "invariant_id": "INV-001",
      "maps_to": "INV-001",
      "argv": [
        "deployctl",
        "release",
        "production"
      ],
      "raw_native_output": "{\"matchedRules\":[{\"prefixRuleMatch\":{\"matchedPrefix\":[\"deployctl\",\"release\"],\"decision\":\"prompt\"}}],\"decision\":\"prompt\"}",
      "native_matched_rules_count": 1,
      "actual_decision": "prompt",
      "expected_decision": "prompt",
      "invariant_expected": [
        "prompt",
        "forbidden"
      ],
      "verdict": "pass",
      "layer": "rules-layer",
      "corpus_shard": "public",
      "evidence_class": "REPRO",
      "pinned": {
        "harness": "codex",
        "harness_version": "0.149.0",
        "binary_sha256": "bbc3341e44c9ead340ed9570c17be936e37870f570751a941699ffd04d672827",
        "rules_sha256": "f9e801ed632f4df231cc27d143736553bd5f2bf9b42e97fb1bad096617220852",
        "invariants_sha256": "aa4fcb9f4271ff1bc652e5ec09c475516ecf960986faaf78674a4140a69b9e05",
        "corpus_version_hash": "f802397753dd933ee089105f304d5e70e61501402d7e5267d5922290c9ffa8bc"
      }
    },
    {
      "schema_version": "finding.v1",
      "fixture_id": "F-05",
      "invariant_id": "INV-005",
      "maps_to": "INV-005",
      "argv": [
        "curl",
        "https://example.com"
      ],
      "raw_native_output": "{\"matchedRules\":[]}",
      "native_matched_rules_count": 0,
      "actual_decision": "unknown",
      "expected_decision": "unknown",
      "invariant_expected": [
        "prompt",
        "forbidden",
        "unmatched-reported-as-unknown"
      ],
      "verdict": "pass",
      "layer": "rules-layer",
      "layer_attribution": "no rules-layer decision; runtime outcome depends on approval policy + sandbox under the pinned configuration.",
      "corpus_shard": "public",
      "evidence_class": "REPRO",
      "pinned": {
        "harness": "codex",